{
  "$schema": "../schemas/roadmap.schema.json",
  "version": "1.0.0",
  "last_updated": "2024-01-15T10:30:00Z",
  "phases": [
    {
      "id": "foundation",
      "title": "Phase 1: Foundation",
      "description": "Establish security fundamentals and build security awareness",
      "order": 1
    },
    {
      "id": "integration",
      "title": "Phase 2: Integration",
      "description": "Integrate security into development workflows and CI/CD pipelines",
      "order": 2
    },
    {
      "id": "optimization",
      "title": "Phase 3: Optimization",
      "description": "Optimize security processes and achieve security maturity",
      "order": 3
    }
  ],
  "items": [
    {
      "id": "security-champions",
      "title": "Establish Security Champions",
      "description": "Identify and train security champions within development teams to promote security culture.",
      "phase": "foundation",
      "order": 1,
      "category": "culture",
      "tools": ["slack", "microsoft-teams"],
      "resources": ["devsecops-handbook"],
      "estimated_time": "2 weeks",
      "difficulty": "beginner",
      "prerequisites": ["management-buy-in"],
      "outcomes": ["Security champions identified", "Basic security awareness established"],
      "assessment": "Survey team members on security awareness"
    },
    {
      "id": "basic-training",
      "title": "Implement Basic Security Training",
      "description": "Provide foundational security training covering OWASP Top 10, secure coding practices, and threat modeling basics.",
      "phase": "foundation",
      "order": 2,
      "category": "training",
      "tools": ["owasp-top-10", "portswigger-academy"],
      "resources": ["owasp-top-10", "security-now"],
      "estimated_time": "4 weeks",
      "difficulty": "beginner",
      "prerequisites": ["security-champions"],
      "outcomes": ["Team security literacy improved", "Common vulnerabilities understood"],
      "assessment": "Security knowledge quiz scores >80%"
    },
    {
      "id": "sast-integration",
      "title": "Integrate SAST in CI/CD",
      "description": "Implement Static Application Security Testing in continuous integration pipelines to catch security issues early.",
      "phase": "integration",
      "order": 1,
      "category": "sast",
      "tools": ["sonarqube", "semgrep", "codeql"],
      "resources": ["sans-dev540"],
      "estimated_time": "3 weeks",
      "difficulty": "intermediate",
      "prerequisites": ["basic-training"],
      "outcomes": ["Automated security scanning in pipelines", "Reduced security debt"],
      "assessment": "Zero critical SAST findings in production"
    },
    {
      "id": "container-security",
      "title": "Implement Container Security",
      "description": "Secure container images and runtime environments with scanning and policy enforcement.",
      "phase": "integration",
      "order": 2,
      "category": "container-security",
      "tools": ["trivy", "clair", "docker-bench"],
      "resources": ["trivy-documentation"],
      "estimated_time": "2 weeks",
      "difficulty": "intermediate",
      "prerequisites": ["sast-integration"],
      "outcomes": ["Container images scanned automatically", "Vulnerability remediation process established"],
      "assessment": "Zero high/critical CVEs in production containers"
    },
    {
      "id": "threat-modeling",
      "title": "Implement Threat Modeling Processes",
      "description": "Establish systematic threat modeling practices for identifying and mitigating security risks in application design.",
      "phase": "optimization",
      "order": 1,
      "category": "threat-modeling",
      "tools": ["owasp-threat-dragon", "stride"],
      "resources": ["threat-modeling-book"],
      "estimated_time": "4 weeks",
      "difficulty": "advanced",
      "prerequisites": ["container-security"],
      "outcomes": ["Proactive risk identification", "Security-by-design culture"],
      "assessment": "Threat models completed for all new features"
    },
    {
      "id": "security-metrics",
      "title": "Establish Security Metrics and KPIs",
      "description": "Define and track security metrics to measure program effectiveness and drive continuous improvement.",
      "phase": "optimization",
      "order": 2,
      "category": "metrics",
      "tools": ["grafana", "prometheus", "elk-stack"],
      "resources": ["security-metrics-book"],
      "estimated_time": "3 weeks",
      "difficulty": "advanced",
      "prerequisites": ["threat-modeling"],
      "outcomes": ["Data-driven security decisions", "Continuous improvement culture"],
      "assessment": "Monthly security dashboard reviews with stakeholders"
    }
  ]
}